page,code,title,blurb,href
22,33113,Data Entry Operator III,"A Data Entry Operator III assigns and reviews the work of subordinate data entry operators. Work of this class involves no supervisory responsibilities. Incumbents receive moderate supervision from a technical superior. Employees in this class may be required to work rotating shifts to provide evening ,  night and weekend coverage. Work is performed in an office where employees may be exposed to minor physical discomforts associated with video display terminals. Work requires minimal physical exertion. DISTINGUISHING FEATURES OF THE WORK The work of this class is distinguished from that of the class of Data Entry Operator II in that it involves the performance of lead work.",/careers/baltimorecity/classspecs/791050
22,33102,Database Specialist,"A Database Specialist develops, maintains, administers, and implements modifications to database management systems. May Supervise. Incumbents receive general supervision from a technical superior.  Employees in this class work a conventional workweek and are subject to 24-hour callback as required for emergencies.  Work is performed in an office where there is no exposure to uncomfortable or hazardous working conditions.  Work requires minimal physical exertion. DISTINGUISHING FEATURES OF THE WORK Not Applicable.",/careers/baltimorecity/classspecs/791053
22,82146,Day Care Program Director,A Day Care Program Director plans and directs the activities of a child day care program. Work of this class involves supervising day care program staff. Incumbents receive general supervision from an administrative superior. Employees in this class work a conventional workweek. Work is performed in an office where working conditions are normal and may involve visits to day care center sites. Work requires minimal physical exertion. DISTINGUISHING FEATURES OF THE WORK Not Applicable.,/careers/baltimorecity/classspecs/791054
22,62425,Dental Assistant (Board Qualified),A Dental Assistant  (Board Qualified) assists dental professionals and staff in the examination and treatment of patients and in the administration of a dental program. Work of this class involves no supervisory duties or responsibilities. Incumbents receive moderate supervision from a technical superior. Employees in this class work a conventional workweek. Work is performed in an office where working conditions are normal. Work requires minimal physical exertion. DISTINGUISHING FEATURES OF THE WORK Not Applicable.,/careers/baltimorecity/classspecs/791056
22,54469,Deputy Towing Manager,"A Deputy Towing Manager oversees towing operations and directs the customer service and cashiering operations of the City’s Towing operation. The work of this class involves directing customer service and cashiering work units. Incumbents receive general supervision from a technical superior. Employees in this class work a conventional workweek and are subject to 24-hour callback on a rotating basis and as required for emergencies. Work is performed in an office where there are primarily normal working conditions, but where hostile confrontations with members of the general public may be experienced. Work requires minimal physical exertion. DISTINGUISHING FEATURES OF THE WORK Not...",/careers/baltimorecity/classspecs/791059
22,74146,Design Planner I,A Design Planner I performs city planning design work of increasing complexity. Work of this class involves no supervisory duties or responsibilities. Incumbents receive moderate supervision from a technical superior. Employees in this class work a conventional work week. Work is performed in an office where normal working conditions are encountered. Work requires minimal physical exertion. DISTINGUISHING FEATURES OF THE WORK The work of this class is distinguished from that of the class of Design Planner II in that it involves responsibil­ity for a number of planning and design work projects or projects of a similar nature.,/careers/baltimorecity/classspecs/791060
22,74147,Design Planner II,A Design Planner II performs comprehensive design projects requiring knowledge of specialized areas of city planning and design. Work of this class involves no supervisory duties or responsibilities. Incumbents receive general supervision from a technical superior. Employees in this class work a conventional workweek. Work is performed in an office where normal working conditions are encountered. Work requires minimal physical exertion. DISTINGUISHING FEATURES OF THE WORK The work of this class is distinguished from that of Design Planner I in that it involves conducting complicated specialized city planning design projects.,/careers/baltimorecity/classspecs/791061
22,74149,Design Planner Supervisor,"A Design Planner Supervisor participates in and oversees the identification, design and planning of urban landscape enhancement projects. Work of this class involves supervising design planners. Incumbents receive general supervision from a technical superior. Employees in this class work a conventional workweek that may include evening and weekend hours. Work is performed in an office where working conditions are normal. Work requires minimal physical exertion. DISTINGUISHING FEATURES OF THE WORK Not Applicable.",/careers/baltimorecity/classspecs/791063
22,52514,Desktop Publishing Coordinator,"A Desktop Publishing Coordinator installs, modifies and trains staff in the use of desktop publishing software used in graphic and typographic design work. The work of this class involves no supervisory duties or responsibilities. Incumbents receive moderate supervision from an administrative superior. Employees work a conventional workweek. Work is performed in an office where normal working conditions are encountered. Work requires minimal physical exertion. DISTINGUISHING FEATURES OF THE WORK Not Applicable.",/careers/baltimorecity/classspecs/791064
23,33828,Director of Legislative Reference,"A Director of Legislative Reference plans and coordinates the legislative reference activities of the City of Baltimore. The work of this class involves directing the activities of library, archives and records management and legal drafting work units. Incumbents receive executive direction from an appointed board. Employees in this class work a conventional workweek. Work is performed in an office where normal working conditions are encountered. The work requires minimal physical exertion. DISTINGUISHING FEATURES OF THE WORK Not Applicable.",/careers/baltimorecity/classspecs/791067
23,61193,"Director, Adolescent and Reproductive Health","A Director, Adolescent and Reproductive Health plans, coordinates and directs programs to foster adolescent and reproductive programs. Work of this class involves directing the activities of multiple reproductive health program work units. Incumbents receive general supervision from an administrative superior. Employees in this class work a conventional workweek. Work is performed in an office where working conditions are normal. Work requires minimal physical effort. DISTINGUISHING FEATURES OF THE WORK Not Applicable.",/careers/baltimorecity/classspecs/791068
23,61127,"Director, Chronic Disease Prevention and Restitution","A Director, Chronic Disease Prevention and Restitution oversees the development and implementation of programs to promote prevention and cessation of tobacco use and improved health care for uninsured and underinsured Baltimore City residents. Work of this class involves supervising program compliance, epidemiology and administrative support personnel.  Incumbents receive managerial direction from a technical superior. Employees in this class work a conventional workweek. Work is performed in an office where normal working conditions are encountered. Work requires minimal physical exertion. DISTINGUISHING FEATURES OF THE WORK Not Applicable.",/careers/baltimorecity/classspecs/791073
23,61115,"Director, Early Intervention Services","Director, Early Intervention Services oversees a system that insures the availability and delivery of early intervention services to developmentally delayed children in Baltimore City. Work of this class involves no supervisory duties. Incumbents receive managerial direction from an administra­tive superior. Employees in this class work a conventional workweek. Work is performed in an office where there is minimal exposure to environmental hazards. Work requires minimal physical exertion. DISTINGUISHING FEATURES OF THE WORK Not Applicable.",/careers/baltimorecity/classspecs/791074
23,81376,"Director, Geriatric Health Services","A Director, Geriatric Health Services directs geriatric health and social services programs. Work of this class involves directing the activities of social program, home services, geriatric evaluation and volunteer program work units. Incumbents receive general direction from an administrative superior. Employees in this class work a conventional workweek. Work is performed in the office where working conditions are normal. Work requires minimal physical exertion. DISTINGUISHING FEATURES OF THE WORK Not Applicable.",/careers/baltimorecity/classspecs/791075
23,61224,"Director, Health Program Planning and Evaluation","A Director, Health Program Planning and Evaluation evaluates, analyzes and recommends improvements to health care programs. Work of this class involves no supervisory duties or responsibilities. Incumbents receive general supervision from a technical superior. Employees in this class work a conventional workweek. Work is performed in an office where normal working conditions are encountered. Work requires minimal physical exertion. DISTINGUISHING FEATURES OF THE WORK Not Applicable.",/careers/baltimorecity/classspecs/791076
23,81418,"Director, Operation Safe Kids","A Director, Operation Safe Kids plans, coordinates and directs the activities of a human services program which engages high risk and repeat offenders to discourage violence and criminal activity.   Work of this class involves directing the activities of clinical and human services work units. Incumbents receive general supervision from an administrative superior. Employees in this class work a conventional workweek, subject to evening and weekend work and may be required to be on-call on a 24 hour basis in case of emergencies. Work is performed primarily in an office where working conditions are normal and on-site visits to client homes and communities where there may be exposure to...",/careers/baltimorecity/classspecs/791077
23,62312,"Director, Oral Health Services","A Director, Oral Health Services plans and directs a public oral health-screening program. Work involves directing the activities of dentists, dental hygienists, dental assistants and clerical staff. Incumbents receive executive direction from an administrative supervisor. Employees in this class work a conventional workweek. Work is performed in an office where working conditions are normal. Work requires minimal physical exertion.  DISTINGUISHING FEATURES OF THE WORK Not Applicable.",/careers/baltimorecity/classspecs/791078
23,81247,"Director, WIC Program","A Director, WIC Program plans and coordinates a Federally funded supplemental food program. Work of this class involves directing the work of nutrition, administrative and clerical work units. Incumbents receive general supervision from a technical superior. Employees in this class work a conventional workweek. Work is performed in an office where normal working conditions are encountered. Work requires minimal physical exertion. DISTINGUISHING FEATURES OF THE WORK Not Applicable.",/careers/baltimorecity/classspecs/791080
23,53690,Dock Master,A Dock Master coordinates dock-based activities in the Inner Harbor and resolves problems and complaints of the boating public. Work of this class involves supervising laborers. Incumbents receive general supervision from an administrative superior. Employees in this class work five days per week including Saturday and Sunday. Work is performed in the Dock Master's office where there are few uncomfortable conditions. Work requires minimal physical exertion. DISTINGUISHING FEATURES OF THE WORK Not Applicable.,/careers/baltimorecity/classspecs/791081
24,33188,Document Imaging Manager,"A Document Imaging Manager develops, implements, coordinates and directs an imaging processing system to store and retrieve documents and information in a City agency. Work of this class involves supervising office support personnel. Incumbents receive general supervision from a technical superior. Employees in this class work a conventional workweek. Work is performed in an office with some exposure to computer terminal monitors. Work requires minimal physical effort. DISTINGUISHING FEATURES OF THE WORK Not Applicable.",/careers/baltimorecity/classspecs/791082
24,33675,DPW Safety & Training Manager,"A DPW Safety & Training Manager oversees the planning, organizing and implementing of occupational safety enforcement and in-service training programs. Work of this class involves directing training and safety enforcement personnel. Work is performed under general supervision from an administrative superior.  Employees in this class work a conventional workweek and are subject to 24-hour callback as required for emergencies. Work is performed in an office where normal working conditions exist and requires visits to emergency sites where there may be hazardous conditions. Work requires minimal physical exertion. DISTINGUISHING FEATURES OF THE WORK Not Applicable.",/careers/baltimorecity/classspecs/791083
24,33645,DPW Training Supervisor,"A DPW Training Supervisor oversees and engages in the development and provision of classes in safety and other subject areas related to the work of the Departments of Public Works and Transportation. The work of this class involves supervising Department of Pubic Works’ Training Officers. Incumbents receive general supervision from an administrative superior. Employees in this class work a conventional workweek that may include evening and weekend hours. Work is usually performed in an office or classroom setting where working conditions are normal, and occasionally in the field where there may be exposure to dust, vehicular traffic and inclement weather. Work requires minimal physical...",/careers/baltimorecity/classspecs/791084
24,54437,Driver I,"A Driver I drives vehicles such as automobiles, vans, busses, panel or pick-up trucks and other 2 ½ to 6 ton trucks and performs laboring tasks. Work of this class involves no supervisory duties or responsibilities. Incumbents receive close supervision from a technical superior. Employees in this class work a conventional workweek which may require some evening, weekend, holiday or callback duty.  Work is performed in vehicles and at construction or maintenance work-sites where incumbents are exposed to such conditions as inclement weather, poor driving conditions, traffic hazards, heights, noxious odors and toxic chemicals. Some positions in the Health Department may be exposed to...",/careers/baltimorecity/classspecs/791087
24,32937,E-Discovery Coordinator,"An E-Discovery Coordinator develops and implements department-wide policies and procedures for electronic discovery and a document management database system to collect, maintain and preserve electronic and paper evidence for use in depositions, hearings and trials; interprets laws and prepares a wide variety of legal documents for approval by attorneys. The work of this class involves no supervisory duties or responsibilities. Incumbents receive moderate supervision from a technical superior. Employees in this class work a conventional workweek. Work is performed in an office where normal working conditions are encountered. Work requires minimal physical exertion. DISTINGUISHING FEATURES OF...",/careers/baltimorecity/classspecs/821016
24,74311,Economic Development Officer,"An Economic Development Officer reviews and processes applications from property buyers for loans, mortgages and financing. Work of this class involves no supervisory duties or responsibilities. Incumbents receive general supervision from a technical superior. Employees in this class work a conventional workweek. Work is performed in an office where normal working conditions are encountered. Work requires minimal physical exertion. DISTINGUISHING FEATURES OF THE WORK Not Applicable.",/careers/baltimorecity/classspecs/791090
24,74392,Economic Empowerment Officer,An Economic Empowerment Officer creates opportunities and coordinates with workforce development programs and partners to support economic empowerment activities through implementation of transportation projects in Baltimore City. Work of this class involves no supervisory duties or responsibilities. Incumbents receive general supervision from an administrative superior. Employees in this class work a conventional workweek. Work is performed in an office where normal working conditions are encountered. Work requires minimal physical exertion. DISTINGUISHING FEATURES OF THE WORK Not Applicable.,/careers/baltimorecity/classspecs/842628
24,33173,EDP Communications Coordinator I,"An EDP Communications Coordinator I installs, maintains and monitors the operation of electronic data processing communications systems and automated office equipment. Work of this class involves no supervisory duties or responsibilities. Incumbents receive general supervision from a technical superior. Employees in this class work a conventional workweek. Work is performed in an office where working conditions are normal. Work requires lifting moderately heavy equipment and installing cable in an office. DISTINGUISHING FEATURES OF THE WORK The work of this class is distinguished from that of the class of EDP Communications Coordinator II in that it involves work assignments of a specific...",/careers/baltimorecity/classspecs/791092
24,33174,EDP Communications Coordinator II,"An EDP Communications Coordinator II plans, develops, installs and maintains electronic data processing communications systems. Work of this class involves no supervisory duties or responsibilities. Incumbents receive general supervision from a technical superior. Employees in this class work a conventional workweek. Work is performed in an office where working conditions are normal. Work requires lifting moderately heavy equipment and installing cable in an office. DISTINGUISHING FEATURES OF THE WORK The work of this class is distinguished from that of the class of EDP Communications Coordinator I in that it involves work assignments of a complex nature requiring an advanced knowledge of...",/careers/baltimorecity/classspecs/791093
24,33182,EDP Data Technician II,"An EDP Data Technician II schedules computer operations, controls the quality and production of computer-processed documents and operates computer peripheral equipment. The work of this class involves no supervisory duties or responsibilities. Incumbents receive moderate supervision from a technical superior. Employees in this class may be required to work shifts, weekends and holidays. Work is performed in an office where working conditions are normal. The work requires minimal physical exertion. DISTINGUISHING FEATURES OF THE WORK The work of this class is distinguished from that of EDP Data Technician III in that it involves no assignments of a complex nature and no lead work.",/careers/baltimorecity/classspecs/791095
25,33183,EDP Data Technician III,"An EDP Data Technician III performs computer operations production control work of a complex nature and may assign and review work.   The work of this class involves no supervisory duties or responsibilities. Incumbents receive general supervision from a technical superior. Employees in this class may be required to work shifts, weekends and holidays. Work is performed in an office where working conditions are normal. The work requires minimal physical exertion. DISTINGUISHING FEATURES OF THE WORK The work of this class is distinguished from that of EDP Data Technician II in that it involves assignments of a complex nature and, also, involves major data processing operations projects. The...",/careers/baltimorecity/classspecs/791096
25,33185,EDP Data Technician Supervisor,"An EDP Data Technician Supervisor oversees, evaluates and approves the work of edp data technicians. The work of this class involves supervising data technician personnel. Incumbents receive general supervision from a technical superior. Employees in this class may be required to work shifts, weekends and holidays. Work is performed in an office where working conditions are normal. The work requires minimal physical exertion. DISTINGUISHING FEATURES OF THE WORK Not Applicable.",/careers/baltimorecity/classspecs/791097
25,82133,Educational Coordinator,"An  Educational Coordinator evaluates and monitors the educational needs of pre-school, primary and secondary school children or court-involved youths in educational and rehabilitation outreach programs, evaluates teaching staff and/or provides educational advocacy and technical assistance. Work of this class involves no supervisory duties or responsibilities. Incumbents receive general supervision from a technical superior. Employees in this class work a conventional workweek. Work is performed in day care centers, clients’ homes, schools and other community settings where working conditions are normal. Work requires minimal physical exer­tion. DISTINGUISHING FEATURES OF THE WORK Not...",/careers/baltimorecity/classspecs/791101
25,54352,Electrical Maintenance Technician II,"An Electrical Maintenance Technician II installs, maintains and repairs electrical components such as electric motors, controllers, conduits, telemetering circuits, cables and heating and exhaust systems in a water or waste water treatment plant or pumping station. Work of this class involves no supervisory duties or responsibilities. Incumbents receive moderate supervision from a technical superior. Employees in this class work a conventional workweek, subject to 24-hour callback for emergencies. Work is performed in an electrical workshop or in a water or wastewater treatment plant or pumping station where there may be occasional exposure to chemicals, high voltage electricity, dust and...",/careers/baltimorecity/classspecs/791102
25,54353,Electrical Maintenance Technician III,"A Electrical Maintenance Technician III installs, maintains and repairs electrical components such as electric motors, controllers, conduits, telemetering circuits, cables and heating and exhaust systems in a water or waste water treatment plant or pumping station and provides work direction to lower level technicians. Work of this class involves no supervisory duties or responsibilities. Incumbents receive moderate supervision from a technical superior. Employees in this class work a conventional workweek, subject to 24-hour callback for emergencies. Work is performed in an electrical workshop or in a water or wastewater treatment plant or pumping station where there may be occasional...",/careers/baltimorecity/classspecs/791103
25,54355,Electrical Maintenance Technician Supervisor I,"An Electrical Maintenance Technician Supervisor I schedules, coordinates and participates in the installation, maintenance and repair of electrical components such as electric motors, controllers, conduits, telemetering circuits, cables and heating and exhaust systems in a water or waste water treatment plant or pumping station. Work of this class involves supervising electrical maintenance personnel. Incumbents receive general supervision from a technical superior. Employees in this class work a conventional workweek, subject to 24-hour callback for emergency situations. Work is performed in a water or waste water treatment plant or pumping station where there may be occasional exposure to...",/careers/baltimorecity/classspecs/791104
25,54356,Electrical Maintenance Technician Supervisor II,"An Electrical Maintenance Technician Supervisor II directs the supervision of electrical maintenance and repair activities at a water or wastewater treatment plant or pumping station and integrates and coordinates these maintenance functions with those of other related fields. Work of this class involves directing the activities of electrical maintenance work units. Incumbents receive general supervision from a technical superior. Employees in this class work a conventional workweek subject to 24-hour call back for emergencies. Work is performed in a water or wastewater treatment plant or pumping station where there may be occasional exposure to chemicals, high voltage electricity, dust and...",/careers/baltimorecity/classspecs/791105
25,52210,Electrical Mechanic Apprentice,"An Electrical Mechanic Apprentice receives classroom instruction, on-the-job training and participates in installation, maintenance and repair of interior and exterior electrical and power distribution systems.  Work of this class involves no supervisory duties or responsibilities. Incumbents receive close supervision from a technical superior.  Employees in this class work a conventional workweek which may include evenings, weekends and holidays on a rotating basis, and are subject to 24-hour call-back as required for emergencies.  Work is performed in a workshop and at repair sites where there is occasional exposure to high voltage, inclement weather, heat, heights, paint and welding fumes...",/careers/baltimorecity/classspecs/1208026
