page,code,title,blurb,href
1,33352,911 Lead Operator,"A 911 Lead Operator assigns, reviews and corrects the work of 911 Operators answering police emergency (911) telephone calls. The work of this class involves leading 911 Operators but does not involve full supervisory duties or responsibilities. Incumbents receive moderate supervision from a technical superior. Employees in this class work rotating shifts including weekends and legal holidays. Work is performed in an office where there are few hazardous conditions but where high mental pressure and stress may be encountered at times. The work requires minimal physical exertion. DISTINGUISHING FEATURES OF THE WORK The work of this class is distinguished from that of the class of 911 Operator...",/careers/baltimorecity/classspecs/790800
1,33351,911 Operator,A 911 Operator operates emergency telephone equipment and answers police emergency (911) telephone calls for assistance from the general public. The work of this class involves no supervisory duties or responsibilities. Incumbents receive moderate supervision from a technical superior. Employees in this class work a rotating shift including weekends and legal holidays. Work is performed in an office where there are few hazardous conditions but where high mental pressure and stress may be encountered at times. Work requires minimal physical exertion. DISTINGUISHING FEATURES OF THE WORK The work of this class is distinguished from that of the class of 911 Lead Operator in that it does not...,/careers/baltimorecity/classspecs/790801
1,33355,911 Operator Supervisor,A 911 Operator Supervisor coordinates and directs police emergency (911) call activities in the Police Department. Work of this class involves supervising subordinate police emergency communications personnel. Incumbents receive general supervision from a technical superior. Employees in this class work rotating shifts including weekends and legal holidays. Work is performed in an office where there are few hazardous conditions but where high mental pressure and stress may be encountered at times. Work requires minimal physical exertion. DISTINGUISHING FEATURES OF THE WORK Not Applicable.,/careers/baltimorecity/classspecs/790802
1,34141,Accountant I,"An Accountant I performs a variety of accounting tasks. Work of this class involves no supervisory duties or responsibilities. Incumbents receive moderate supervision from a technical superior. Employees in this class work a conventional workweek. Work is performed in an office where working conditions are normal. Work requires minimal physical exertion. DISTINGUISHING FEATURES OF THE WORK The work of this class is distinguished from that of Accountant II in that it involves no lead work. It is also distinguished in that it involves no specialized duties such as developing accounting systems for third party contractors, preparing detailed financial reports, and conferring with program...",/careers/baltimorecity/classspecs/790803
1,34142,Accountant II,"An Accountant II performs such lead work as assigning, reviewing and approving the work of accounting personnel or performs specialized accounting work. Work of this class involves no supervisory duties or responsibilities. Incumbents receive general supervision from a technical superior. Employees in this class work a conventional workweek. Work is performed in an office where working conditions are normal. Work requires minimal physical exertion. DISTINGUISHING FEATURES OF THE WORK The work of this class is distinguished from that of Accountant I in that it involves developing and monitoring accounting systems for third party programs, preparing detailed financial reports, conferring with...",/careers/baltimorecity/classspecs/790804
1,34145,Accountant Supervisor,"An Accountant Supervisor plans, schedules and coordinates accounting work for a City government agency. Work of this class involves supervising accounting personnel. Incumbents receive general supervision from a technical superior. Employees work a conventional workweek. Work is performed in an office where working conditions are normal. Work requires minimal physical exertion. DISTINGUISHING FEATURES OF THE WORK Not Applicable.",/careers/baltimorecity/classspecs/790805
1,34191,Accountant Trainee,An Accountant Trainee receives training in governmental accounting practices and procedures. The work of this class involves no supervisory duties or responsibilities. Incumbents receive close supervision from a technical superior. Employees in this class work a conventional workweek. Work is performed in an office where working conditions are normal. Work requires minimal physical effort. DISTINGUISHING FEATURES OF THE WORK Not Applicable.,/careers/baltimorecity/classspecs/790806
1,34131,Accounting Assistant I,An Accounting Assistant I maintains bookkeeping records and makes and verifies computations. The work of this class involves no supervisory duties or responsibilities. Incumbents receive close supervision from a technical superior. Employees in this class work a conventional workweek. Work is performed in an office where working conditions are normal. The work requires minimal physical exertion. DISTINGUISHING FEATURES OF THE WORK The work of this class is distinguished from that of Accounting Assistant II in that it involves such routine bookkeeping duties as the verification of computations and fiscal data and the maintenance of logs and basic bookkeeping records.,/careers/baltimorecity/classspecs/790807
1,34132,Accounting Assistant II,"An Accounting Assistant II maintains journals and balances and reconciles accounts and records. The work of this class involves no supervisory duties or responsibilities. Incumbents receive moderate supervision from a technical superior. Employees in this class work a conventional workweek. Work is performed in an office where working conditions are normal. The work requires minimal physical exertion. DISTINGUISHING FEATURES OF THE WORK The work of this class is distinguished from that of an Accounting Assistant I in that it involves such duties as the maintaining of journals, balancing accounts and performing a variety of activities requiring a knowledge of bookkeeping procedures and...",/careers/baltimorecity/classspecs/790808
1,34133,Accounting Assistant III,"An Accounting Assistant III prepares financial statements and records, examines accounts and records for compliance with accounting procedures, adjusts a variety of accounts and performs a wide range of specialized calculation and analysis work. The work of this class involves no supervisory duties or responsibilities. Incumbents receive moderate supervision from a technical superior. Employees in this class work a conventional workweek. Work is performed in an office where working conditions are normal. The work requires minimal physical exertion. DISTINGUISHING FEATURES OF THE WORK The work of this class is distinguished from that of Accounting Assistant II in that it involves auditing...",/careers/baltimorecity/classspecs/790809
2,34146,Accounting Manager,An Accounting Manager directs and coordinates the activities of an accounting section in a City agency. The work of this class involves supervising the activities of accounting and fiscal work units. Incumbents receive managerial direction from an administrative superior. Employees in this class work a conventional workweek. Work is performed in an office where normal working conditions are encountered. Work requires minimal physical exertion. DISTINGUISHING FEATURES OF THE WORK Not Applicable,/careers/baltimorecity/classspecs/790811
2,34197,Accounting Systems Administrator,"An Accounting Systems Administrator plans, directs and coordinates the activities of a centralized citywide accounting systems operations section. Work of this class involves supervising the activities of professional and paraprofessional accounting and clerical support work units. Incumbents receive managerial direction from a technical superior. Employees in this class work a conventional workweek. Work is performed in an office where normal working conditions are encountered. The work requires minimal physical exertion. DISTINGUISHING FEATURES OF THE WORK Not Applicable.",/careers/baltimorecity/classspecs/790812
2,34151,Accounting Systems Analyst I,An Accounting Systems Analyst I analyzes accounting systems in a City agency. The work of this class involves no supervisory responsibilities. Incumbents receive moderate supervision from a technical superior. Employees in this class work a conventional workweek. Work is performed in an office where working conditions are normal. Work requires minimal physical exertion. DISTINGUISHING FEATURES OF THE WORK The work of this class is distinguished from that of the class of Accounting Systems Analyst II in that it involves analyzing accounting systems in a City agency where accounting system assignments are limited due to the lack of variety and complexity.,/careers/baltimorecity/classspecs/790813
2,31311,Administrative Analyst I,"An Administrative Analyst I conducts management studies and analyses to improve workflow, simplify procedures, and to implement cost reductions. Work of this class involves no supervisory duties or responsibilities. Incumbents receive moderate supervision from an administrative superior. Employees work a conventional workweek. Work is performed in an office setting where there are no uncomfortable conditions. Work requires minimal physical exertion. DISTINGUISHING FEATURES OF THE WORK The work of this class is distinguished from that of the class of Administrative Analyst II in that it conducts studies and analyses to recommend improvements to existing work systems, but does not involve...",/careers/baltimorecity/classspecs/790818
2,31312,Administrative Analyst II,"An Administrative Analyst II conducts management studies and analyses to design, revise or improve systems and regulations in order to meet the various goals and objectives of a department or program. Work of this class involves no supervisory duties or responsibilities. Incumbents receive general supervision from a technical superior. Employees work a conventional work week. Work is performed primarily in an office setting where there are no uncomfortable conditions. Work requires minimal physical exertion.  DISTINGUISHING FEATURES OF THE WORK The work of this class is distinguished from that of the class of Administrative Analyst I in that it involves reviewing existing and proposed laws...",/careers/baltimorecity/classspecs/790819
2,31100,Administrative Coordinator,An Administrative Coordinator performs administrative and operations work.  Work of this class may involve supervising office support personnel. Incumbents receive general supervision from an administrative superior.  Employees in this class work a conventional workweek.  Work is performed in a standard office environment.  Work requires minimal physical exertion. DISTINGUISHING FEATURES OF THE WORK Not Applicable.,/careers/baltimorecity/classspecs/790820
2,33146,Agency IT Associate,"IT Associate provides support and assistance.  Primary focus may be in the areas of computer operations, computer repair, wire and cable installation, user and desktop support (hardware and software), helpdesk, and data management. Incumbents receive moderate to general supervision.  Employees in this class work a conventional workweek.  Work is performed in office settings where there is no exposure to uncomfortable or hazardous working conditions.  Work may require moderate physical exertion in lifting pieces of equipment or working in confined areas. Work in the class has no supervisory responsibilities. DISTINGUISHING FEATURES OF THE WORK Not Applicable.",/careers/baltimorecity/classspecs/1148056
2,33152,Agency IT Manager I,"Alternate market titles: Division director, division head, computer operations manager, systems manager, applications manager, software manager, director, infrastructure and shared services. The position is responsible for planning, directing, controlling, evaluating, and staffing the Agency's IT Division, i.e., two or more functional units, e.g., IT administration, applications and systems development, data security, computer operations, etc.  DISTINGUISHING FEATURES OF THE WORK This is a senior management position that reports directly to the Agency Head/Deputy.  The classification is differentiated based on the size, complexity, and budget of the agency compared to other BCG agencies:...",/careers/baltimorecity/classspecs/1148062
2,33153,Agency IT Manager II,"Alternate market titles: Division director, division head, computer operations manager, systems manager, applications manager, software manager, director, infrastructure and shared services. The position is responsible for planning, directing, controlling, evaluating, and staffing the Agency's IT Division, i.e., two or more functional units, e.g., IT administration, applications and systems development, data security, computer operations, etc.  DISTINGUISHING FEATURES OF THE WORK This is a senior management position that reports directly to the Agency Head/Deputy.  The classification is differentiated based on the size, complexity, and budget of the agency compared to other BCG agencies:...",/careers/baltimorecity/classspecs/1148078
2,33157,Agency IT Manager III,"Alternate market titles: Division director, division head, computer operations manager, systems manager, applications manager, software manager, director, infrastructure and shared services. The position is responsible for planning, directing, controlling, evaluating, and staffing the Agency's IT Division, i.e., two or more functional units, e.g., IT administration, applications and systems development, data security, computer operations, etc.  DISTINGUISHING FEATURES OF THE WORK This is a senior management position that reports directly to the Agency Head/Deputy.  The classification is differentiated based on the size, complexity, and budget of the agency compared to other BCG agencies:...",/careers/baltimorecity/classspecs/1148050
3,33147,Agency IT Specialist I,"Alternate market titles:  Systems analyst, applications systems analyst/programmer, database specialist, systems programmer, network engineer, GIS analyst, architectural engineer, business analyst, quality improvement specialist, helpdesk analyst, security analyst. An Information Technology Specialist provides technical support to customers for personal computers, network system infrastructure equipment, including testing, updating, maintaining, and providing training on mainframe client servers and microcomputer software and hardware; responds to helpdesk requests.  Work of this class may involve leading and training less experienced IT Specialists, but does not involve full supervisory...",/careers/baltimorecity/classspecs/1148077
3,33148,Agency IT Specialist II,"Alternate market titles:  Systems analyst, applications systems analyst/programmer, database specialist, systems programmer, network engineer, GIS analyst, architectural engineer, business analyst, quality improvement specialist, helpdesk analyst, security analyst. An Information Technology Specialist provides technical support to customers for personal computers, network system infrastructure equipment, including testing, updating, maintaining, and providing training on mainframe client servers and microcomputer software and hardware; responds to helpdesk requests.  Work of this class may involve leading and training less experienced IT Specialists, but does not involve full supervisory...",/careers/baltimorecity/classspecs/1148068
3,33149,Agency IT Specialist III,"Alternate market titles:  Systems analyst, applications systems analyst/programmer, database specialist, systems programmer, network engineer, GIS analyst, architectural engineer, business analyst, quality improvement specialist, helpdesk analyst, security analyst. An Information Technology Specialist provides technical support to customers for personal computers, network system infrastructure equipment, including testing, updating, maintaining, and providing training on mainframe client servers and microcomputer software and hardware; responds to helpdesk requests.  Work of this class may involve leading and training less experienced IT Specialists, but does not involve full supervisory...",/careers/baltimorecity/classspecs/1148072
3,33154,Agency IT Specialist IV,"Alternate market titles:  Systems analyst, applications systems analyst/programmer, database specialist, systems programmer, network engineer, GIS analyst, architectural engineer, business analyst, quality improvement specialist, helpdesk analyst, security analyst. An Information Technology Specialist provides technical support to customers for personal computers, network system infrastructure equipment, including testing, updating, maintaining, and providing training on mainframe client servers and microcomputer software and hardware; responds to helpdesk requests.  Work of this class may involve leading and training less experienced IT Specialists, but does not involve full supervisory...",/careers/baltimorecity/classspecs/1148054
3,33150,Agency IT Supervisor,"Alternative market titles: Analyst/programmer supervisor, business analysis supervisor, help desk supervisor, GIS supervisor, computer operations supervisor, IT supervisor, applications supervisor, mainframe supervisor, IT project manager. This classification supervises the planning and implementing of operating systems, applications software upgrades and modifications, and testing, installation, and setup of new hardware. May manage an IT project team.  Ensures agencies' compliance with warranties, contracts and copyrights. Analyzes utilization trends of service requests, breakdowns, and malfunctions and recommends appropriate changes in procedures and operations. DISTINGUISHING FEATURES OF...",/careers/baltimorecity/classspecs/1148065
3,33144,Analyst/Programmer II,"An Analyst/Programmer II performs a wide variety of systems design development and computer programming. The work of this class involves no supervisory duties or responsibilities. Incumbents receive moderate supervision from a technical superior. Employees in this class may be required to work shifts, weekends and holidays. Work is performed in an office where working conditions are normal. The work requires minimal physical exertion.  DISTINGUISHING FEATURES OF THE WORK The work of this class is distinguished from that of Analyst/ Programmer I in that it involves developing systems designs with a variety of procedures and instructions.",/careers/baltimorecity/classspecs/790826
3,33145,Analyst/Programmer Supervisor,"An Analyst/Programmer Supervisor supervises, plans, coordinates, and participates in a wide variety of systems analysis and computer programming. The work of this class involves supervising Analyst/Programmers and other information technology technicians and technical support workers. Incumbents receive general supervision from a technical superior. Employees in this class may be required to work evenings, weekends and holidays. Work is performed in an office where working conditions are normal. The work requires minimal physical exertion. DISTINGUISHING FEATURES OF THE WORK The work of this class is distinguished from that of Analyst/ Programmer Lead I in that it involves full supervisory...",/careers/baltimorecity/classspecs/1090368
3,41413,Animal Control Investigator,"An Animal Control Investigator coordinates, investigates and documents findings of animal control and protection cases that involve animal bites and similarly complex cases. Work of this class involves no supervisory duties or responsibilities. Incumbents receive moderate supervision from a technical superior. Employees in this class work a conventional workweek, but are subject to 24-hour call-back. Work is mostly in an office, but also involves field visits in the community where such conditions as seasonal weather extremes and hostile confrontations may be encountered. Work requires minimal physical exertion. DISTINGUISHING FEATURES OF THE WORK Not Applicable.",/careers/baltimorecity/classspecs/790827
3,41411,Animal Enforcement Officer,"An Animal Enforcement Officer drives an animal transport truck and responds to a variety of service calls related to animals including calls to retrieve animals in severe distress and deceased animals.  An Animals Enforcement Officer investigate allegations of animal abuse and neglect, takes steps to remove abused or endangered animals from homes and owners, and transports animals safely to the City's shelter or to emergency care.  Work of this class involves no supervisory duties or responsibilities, however they are paired with and assist other officers and may assist in the training of new officers. Incumbents receive moderate supervision from an administrative superior.  Employees in...",/careers/baltimorecity/classspecs/790828
3,41415,Animal Enforcement Officer Supervisor,"An Animal Enforcement Officer Supervisor oversees the collection of stray, dead and sick animals from the community and investigates animal complaints. Work of this class involves supervising Animal Enforcement Officers. Incumbents receive moderate supervision from an administrative superior. Employees in this class work a conventional workweek. Work is performed outdoors where the incumbents are exposed to such conditions as inclement weather and dead, diseased or dangerous animals. Work requires such physical exertion as bending and lifting and pulling small animals. DISTINGUISHING FEATURES OF THE WORK  Not Applicable.",/careers/baltimorecity/classspecs/790829
4,33669,Apprenticeship Program Administrator,"An Apprenticeship Program Administrator coordinates the City’s program to train employees in various skilled trades and crafts that have been registered under the auspices of the State of Maryland. Work of this class may involve leading support employees, but does not involve full supervisory duties or responsibilities. Incumbents receive instruction from a technical superior. Employees work a conventional workweek. Work is performed indoors under normal working conditions. Work requires no physical exertion. DISTINGUISHING FEATURES OF THE WORK Not Applicable",/careers/baltimorecity/classspecs/790831
4,83215,Aquatic Center Director,"An Aquatic Center Director plans, develops, coordinates and implements aquatics recreation programs. Work of this class involves supervising full-time and part-time aquatic and recreation leaders and assistants. Incumbents receive general supervision from a technical superior. Employees in this class work a conventional workweek which may include evening and weekend hours. Work is performed in an aquatic center where unpleasant working conditions are rarely encountered. Work requires moderate physical exertion. DISTINGUISHING FEATURES OF THE WORK Not Applicable.",/careers/baltimorecity/classspecs/851106
4,83115,Aquatic Center Leader,"An Aquatic Center Leader plans, promotes, oversees and conducts aquatic programs at a community aquatic center. Work of this class involves leading part-time pool staff but does not perform full supervisory duties or responsibilities. Incumbents receive moderate supervision from a technical superior. Employees in this class work a conventional workweek which may include evening and weekend hours. Work is performed in aquatic centers where inclement weather conditions may be encountered. Work requires moderate physical exertion. DISTINGUISHING FEATURES OF THE WORK Not applicable.",/careers/baltimorecity/classspecs/851101
4,75111,Architect I,"An Architect I examines and reviews architectural plans, specifications, materials, designs, and methods of construction. Work of this class involves no supervisory duties or responsibilities. Incumbents receive close supervision from a technical superior. Employees in this class work a conventional workweek. Work is performed in an office setting where normal working conditions are encountered. The work requires minimal physical exertion. DISTINGUISHING FEATURES OF THE WORK The work of this class is distinguished from that of the class of Architect II in that it involves the performance of a limited number of professional architectural duties under close supervision.",/careers/baltimorecity/classspecs/790833
4,75112,Architect II,"An Architect II examines, reviews, plans, and designs complex architectural plans, designs, specifications, materials, and methods and styles of construction. Work of this class may involve supervising drafting personnel. Incumbents receive moderate supervision from a technical superior. Employees in this class work a conventional workweek. Work is performed in an office setting where few uncomfortable working conditions are encountered. Work requires minimal physical exertion; however, there are occasional long periods of standing when reviewing architectural plans and designs. DISTINGUISHING FEATURES OF THE WORK The work of this class is distinguished from that of the class Architect I in...",/careers/baltimorecity/classspecs/790834
