page,code,title,blurb,href
68,83211,Recreation Center Director I,"A Recreation Center Director I plans, coordinates and directs a recreation program in a small, limited-use neighborhood center. Work of this class may involve supervising full-time or part-time recreation leaders or aides. Incumbents receive general supervision from a technical superior. Employees in this class work a conventional workweek, which may include evening and weekend hours. Work is performed in a recreation center where unpleasant working conditions are rarely encountered. Work requires moderate physical exertion. DISTINGUISHING FEATURES OF THE WORK The work of this class is distinguished from that of the class of Recreation Center Director II in that it involves directing...",/careers/baltimorecity/classspecs/791565
68,83212,Recreation Center Director II,"A Recreation Center Director II plans, coordinates and directs a recreation program in a one story, multi-room center having a gym and multi-purpose room. Work of this class involves supervising full-time and part-time recreation leaders and aides. Incumbents receive general supervision from a technical superior. Employees in this class work a conventional workweek which may include evening and weekend hours.  Work is performed in a recreation center where unpleasant working conditions are rarely encountered. Work requires moderate physical exertion. DISTINGUISHING FEATURES OF THE WORK The work of this class is distinguished from that of the class of Recreation Center Director III in that it...",/careers/baltimorecity/classspecs/791566
68,83111,Recreation Leader I,"A Recreation Leader I sets up equipment and conducts a variety of sports, games and recreational activities. Work of this class involves no supervisory duties or responsibilities. Incumbents receive close supervision from a technical superior. Employees in this class work a conventional workweek which may include evening and weekend hours. Work is performed in recreation centers, athletic fields and other facilities where inclement weather conditions may be encountered. Work requires moderate physical exertion. DISTINGUISHING FEATURES OF THE WORK The work of this class is distinguished from that of the class of Recreation Leader II in that it involves receiving training in and leading a...",/careers/baltimorecity/classspecs/791567
68,83112,Recreation Leader II,"A Recreation Leader II plans, promotes and conducts center-wide recreational activities. Work of this class involves no supervisory duties or responsibilities. Incumbents receive moderate supervision from a technical superior. Employees in this class work a conventional workweek which may include evening and weekend hours. Work is performed in recreation centers, athletic fields and other facilities where inclement weather conditions may be encountered. Work requires moderate physical exertion. DISTINGUISHING FEATURES OF THE WORK The work of this class is distinguished from that of the class of Recreational Leader I in that it involves planning and organizing recreational activities in...",/careers/baltimorecity/classspecs/791568
68,83113,Recreation Leader II Elder Activities,"A Recreation Leader II Elder Activities, with others, plans, implements and evaluates a daily activities program for the frail elderly. Work of this class involves no supervisory duties or responsibilities. Incumbents receive moderate supervision from a technical superior. Employees in this class work a conventional workweek. Work is performed in a day care setting where there is no exposure to environmental hazards. Work requires minimal physical exertion. DISTINGUISHING FEATURES OF THE WORK Not Applicable.",/careers/baltimorecity/classspecs/791569
68,10291,Recreation Manager,"A Recreation Manager plans, coordinates and directs the operations, activities and promotion of a complex city-wide recreation program.  Work of this class involves directing the activities of recreational program work units. Incumbents receive general supervision from a technical superior.  Employees in this class work a conventional workweek which may include evening and weekend hours.  Work is performed primarily in an office where there is no exposure to uncomfortable or hazardous working conditions.  Work requires minimal physical exertion. DISTINGUISHING FEATURES OF THE WORK The work of this class is distinguished form that of Recreation Program Supervisor in that it involves...",/careers/baltimorecity/classspecs/1228853
68,83233,Recreation Manager,"A Recreation Manager plans, coordinates and directs the operations, activities and promotion of a complex city-wide recreation program. Work of this class involves directing the activities of recreational program work units. Incumbents receive general supervision from a technical superior. Employees in this class work a conventional workweek which may include evening and weekend hours. Work is performed primarily in an office where there is no exposure to uncomfortable or hazardous working conditions. Work requires minimal physical exertion. DISTINGUISHING FEATURES OF THE WORK The work of this class is distinguished form that of Recreation Program Supervisor in that it involves supervising...",/careers/baltimorecity/classspecs/791570
69,83120,Recreation Program Assistant,A Recreation Program Assistant oversees the operation of a specialized citywide recreational activity. Work of this class involves no supervisory duties or responsibilities. Incumbents receive moderate supervision from a technical superior. Employees in this class work a conventional workweek which may include evening and weekend hours. Work is performed mainly in an office where there are no uncomfortable working conditions. Work requires minimal physical exertion. DISTINGUISHING FEATURES OF THE WORK Not Applicable.,/careers/baltimorecity/classspecs/791571
69,83121,Recreation Programmer,"A Recreation Programmer plans, organizes, and promotes a specialized Citywide recreational program. Work of this class involves no supervisory duties or responsibilities. Incumbents receive general supervision from a technical superior. Employees in this class work a conventional workweek which may include evening and weekend hours. Work is performed mainly in an office where there are no uncomfortable working conditions. Work requires minimal physical exertion. DISTINGUISHING FEATURES OF THE WORK The work of this class is distinguished from that of the class of Recreation Program Supervisor in that it does not involve supervising full-time, permanently assigned staff.",/careers/baltimorecity/classspecs/791573
69,33674,Recruitment and Talent Acquisition Specialist I,"A Recruitment and Talent Acquisition Specialist I in the Baltimore City Department of Human Resources performs administrative, operational and transactional functions relative to recruitment, talent acquisition  and assessment testing to ensure that optimum staffing levels are achieved and maintained in the most time-efficient and cost-effective manner. Work of this class involves no supervisory duties or responsibilities. Incumbents receive moderate supervision from a technical superior. Employees in this class work a conventional workweek which may include evening and weekend work as required. Work is performed in an office where there are no uncomfortable or hazardous working...",/careers/baltimorecity/classspecs/1017072
69,33678,Recruitment and Talent Acquisition Specialist II,"The Recruitment & Talent Acquisition Specialist II position is unique to the City of Baltimore Department of Human Resources. It performs professional work assignments and special project assignments that involve research, evaluating/assessing, recommending and advising; and developing, implementing and coordinating viable recruitment and talent acquisition, assessment testing strategies, and programs and initiatives that assist in achieving Agency and organizational outcomes. The position partners with hiring agencies, and liaises between hiring agencies and central DHR's Centers of Excellence representatives to ensure that appropriate staffing levels are achieved and maintained to support...",/careers/baltimorecity/classspecs/1017073
69,33680,Recruitment and Talent Acquisition Specialist III,"A Recruitment and Talent Acquisition Specialist III performs a high volume of complex full life cycle recruitment and talent acquisition, examination and assessment functions  to ensure that optimum staffing levels are achieved and maintained in the most time-efficient and cost-effective manner. Work of this class involves leading professional, paraprofessional and clerical staff, but does not involve full supervisory duties or responsibilities. Incumbents receive general supervision from a technical superior. Employees in this class work a conventional workweek, subject to evening and weekend work as required for operational necessity. Work is performed in an office where there are no...",/careers/baltimorecity/classspecs/1017074
69,53855,Recycling Coordinator,"A Recycling Coordinator plans, develops, oversees and implements the City’s recycling program. Work of this class may involve supervisory duties or responsibilities. Incumbents receive general supervision from a technical superior. Employees in this class work a conventional workweek. Work is performed in an office and in the field where the employees may be exposed to trash and dirt. Work requires minimal physical exertion. DISTINGUISHING FEATURES OF THE WORK Not Applicable.",/careers/baltimorecity/classspecs/791574
69,42981,Recycling Program Associate,"A Recycling Program Associate advises the public on recycling programs and operations and ensures the appropriate collecting and processing of recyclable materials. Work of this class involves no supervisory duties or responsibilities. Incumbents receive moderate supervision from a technical superior. Employees in this class work a conventional workweek. Work is performed at recycling work sites where there is exposure to trash, dirt and noise. Work requires minimal physical exertion. DISTINGUISHING FEATURES OF THE WORK Not Applicable.",/careers/baltimorecity/classspecs/791576
69,81243,Registered Dietitian,A Registered Dietitian counsels individuals and groups on nutritional practices designed to prevent disease and promote health. Work of this class involves no supervisory duties or responsibilities. Incumbents receive moderate supervision from a technical superior. Employees in this class work a conventional workweek and may be required to work weekends. Work is performed in clinics and community facilities where working conditions are normal. Work requires minimal physical exertion. DISTINGUISHING FEATURES OF THE WORK Not Applicable.,/careers/baltimorecity/classspecs/791577
69,75311,Rehabilitation Loan Processor,A Rehabilitation Loan Processor compiles loan documents to determine financial eligibility of an applicant applying for a housing rehabilitation loan.  Work of this class involves no supervisory duties or responsibilities. DISTINGUISHING FEATURES OF THE WORK Not Applicable.,/careers/baltimorecity/classspecs/1195784
69,34218,Remittance Supervisor,"A Remittance Supervisor oversees and coordinates the operations and activities of a work unit engaged in the receipt and processing of in-person cash bill payments or bill payments made by mail or electronically. Work of this class involves supervising cashiers, office assistants and accounting personnel. Incumbents receive general supervision from a technical superior. Employees in this class work a conventional workweek. Work is performed in an office where normal working conditions are encountered. Work requires minimal physical exertion. DISTINGUISHING FEATURES OF THE WORK Not Applicable.",/careers/baltimorecity/classspecs/791580
70,34511,Research Analyst I,"A Research Analyst I, with continuous work review, analyzes data and statistics in a City agency. The work of this class involves no supervisory duties or responsibilities. Incumbents receive close supervision from a technical superior. Employees in this class work a conventional workweek. Work is performed in an office where working conditions are normal. Work requires minimal physical exertion. DISTINGUISHING FEATURES OF THE WORK The work of this class is distinguished from that of the class of Research Analyst II in that it involves research analysis of a limited nature requiring close supervision. Occasionally, employees in this class of Research Analyst I will have an opportunity to...",/careers/baltimorecity/classspecs/791581
70,34512,Research Analyst II,"A Research Analyst II organizes and analyzes data of  international, national and local intelligence and statistics into actionable data in a City agency. The work of this class involves no supervisory duties or responsibilities. Incumbents receive moderate supervision from a technical superior. Employees in this class work a conventional workweek. Positions in this class that are assigned to the Baltimore City Police Department, work a rotating shift, to include evening, weekend and holidays. Work is performed in an office where working conditions are normal. Work requires minimal physical exertion. DISTINGUISHING FEATURES OF THE WORK The work of this class is distinguished from that of the...",/careers/baltimorecity/classspecs/791582
70,34514,Research Analyst Supervisor,"A Research Analyst Supervisor plans, schedules and coordinates the analysis of data of international, national and local intelligence and statistics in a City agency. The work of this class involves supervising research, and office support personnel. Incumbents receive moderate supervision from a technical superior. Employees in this class work a conventional workweek. Work is performed in an office where working conditions are normal. Work requires minimal physical exertion. DISTINGUISHING FEATURES OF THE WORK Not Applicable.",/careers/baltimorecity/classspecs/884984
70,31755,Resource Development Coordinator,A Resource Development Coordinator oversees grants development. Work of this class involves supervising professional and office support personnel. Incumbents receive managerial direction from a technical superior. Employees in this class work a conventional workweek. Work is performed in an office where working conditions are normal. Work requires minimal physical exertion. DISTINGUISHING FEATURES OF THE WORK Not Applicable.,/careers/baltimorecity/classspecs/791583
70,33631,Retirement Benefits Analyst I,"A Retirement Benefit Analyst I provides a full range of retirement plan assistance such as benefits counseling, determining benefits eligibility and calculating benefits to City employees. Work of this class involves no supervisory duties or responsibilities. Incumbents receive general supervision from a technical superior. Employees in this class work a conventional workweek. Work is performed in an office where normal working conditions are encountered. Work requires minimal physical exertion. DISTINGUISHING FEATURES OF THE WORK The work of this class is distinguished from that of the class of Retirement Benefits Analyst II in that it does not perform complex retirement plan benefits...",/careers/baltimorecity/classspecs/791585
70,33632,Retirement Benefits Analyst II,"A Retirement Benefits Analyst II provides complex retirement plan assistance to City employees involving benefits counseling, determining benefits eligibility and calculating benefits of City employees. Work of this class involves no supervisory duties or responsibilities. Incumbents receive minimal supervision from a technical superior. Employees in this class work a conventional workweek. Work is performed in an office where working conditions are normal. Work requires minimal physical exertion. DISTINGUISHING FEATURES OF THE WORK The work of this class is distinguished from that of the class of Retirement Benefits Analyst I in that it involves performing a wide range of complex retirement...",/careers/baltimorecity/classspecs/791586
70,33635,Retirement Benefits Analyst Supervisor,"A Retirement Benefits Analyst Supervisor oversees the work of providing retirement plan assistance to City employees, participates in retirement administration and performs special retirement system projects. Work of this class involves supervising retirement benefits analysts and medical claims processing personnel. Incumbents receive general supervision from an administrative superior. Employees in this class work a conventional workweek. Work is performed in an office where normal working conditions are encountered. Work requires minimal physical exertion. DISTINGUISHING FEATURES OF THE WORK The work of this class is distinguished from that of the class of Retirement Benefits Manager in...",/careers/baltimorecity/classspecs/791587
70,33636,Retirement Benefits Manager,"A Retirement Benefits Manager plans, directs and coordinates the activities and operations of the retirement benefits section of the Employees’ Retirement Systems. Work of this class involves directing the activities of retirement benefits and medical claims processing work units. Incumbents receive general supervision from an administrative superior. Employees in this class work a conventional workweek. Work is performed in an office where normal working conditions are encountered. Work requires minimal physical exertion. DISTINGUISHING FEATURES OF THE WORK The work of this class is distinguished from that of the class of Retirement Benefits Analyst Supervisor in that it oversees, directs...",/careers/baltimorecity/classspecs/791588
70,33641,Safety Enforcement Officer I,"A Safety Enforcement Officer I, with continual work review, enforces the safety rules and regulations of City government by investigating and correcting the occupational safety practices of City agencies. The work of this class involves no supervisory duties or responsibilities. Incumbents receive close supervision from a technical superior. Employees in this class work a conventional workweek which may include evening, weekend and flexible hours. Work is performed at various work sites throughout City government where there are unsafe or unhealthy conditions. Work may require moderate physical exertion including bending, stretching and climbing ladders. DISTINGUISHING FEATURES OF THE WORK...",/careers/baltimorecity/classspecs/791589
70,33642,Safety Enforcement Officer II,"A Safety Enforcement Officer II investigates and enforces the occupational safety and health hazard rules and regulations of City government at City worksites. The work of this class involves no supervisory duties or responsibilities. Incumbents receive close supervision from a technical superior. Employees in this class work a conventional workweek which may include evening, weekend and flexible hours. Work is performed at various work sites throughout the City government where there are unsafe or unhealthy conditions. Work may require moderate physical exertion including bending, stretching and climbing ladders. DISTINGUISHING FEATURES OF THE WORK The work of this class differs from that...",/careers/baltimorecity/classspecs/791590
71,33643,Safety Enforcement Officer III,"A Safety Enforcement Officer III investigates and enforces the occupational safety and health hazard rules and regulations at City work sites and schedules, assigns and reviews the case work of safety enforcement officers. Work of this class involves leading Safety Enforcement Officers, but does not involve fullsupervisory duties or responsibilities. Incumbents receive general supervision from a technical superior. Employees in this class work a conventional workweek which may in­clude evening, weekend and flexible hours. Work is performed at various work sites throughout City government where there are un­safe or unhealthy conditions. Work may require moderate physical exertion including...",/careers/baltimorecity/classspecs/791591
71,52627,SCADA System Supervisor,"A SCADA System Supervisor plans, oversees the installation and maintenance of the process control system for water and wastewater plants, distribution stations and related facilities; and the installation, maintenance and repair of electronic, instrumentation and hydraulic equipment and programmable logic controllers in treatment plants, pumping stations, and related facilities. Work of this class involves directing the activities of electronic maintenance and repair work units. Incumbents receive general supervision from an administrative superior. Employees in this class work a conventional workweek; callback or overtime may be required in emergencies. Work is performed primarily in an...",/careers/baltimorecity/classspecs/791592
71,53821,Scale Attendant,"A Scale Attendant operates a computerized scale, maintains records and collects fees for solid waste or sludge disposal at a municipal landfill or wastewater treatment plant. Work of this class involves no supervisory duties or responsibilities. Incumbents receive moderate supervision from a technical superior. Employees in this class work a conventional workweek. Work is performed at a landfill or wastewater treatment plant where employees encounter dusty or muddy conditions and irate citizens. DISTINGUISHING FEATURES OF THE WORK Not Applicable.",/careers/baltimorecity/classspecs/791593
71,62497,School Health Aide,A School Health Aide in the Baltimore City Health Department performs a variety of school health clinic and office support tasks for Baltimore City Public Schools. Work of this class involves no supervisory duties or responsibilities. Incumbents receive moderate supervision from a technical superior. Employees in this class work a conventional workweek. Work is performed in a school health clinic or health suite where there is occasional exposure to body fluids and students with contagious illnesses. Work requires minimal physical exertion. DISTINGUISHING FEATURES OF THE WORK Not Applicable.,/careers/baltimorecity/classspecs/791594
71,62494,School Health Aide (10 Months),A School Health Aide in the Baltimore City Health Department performs a variety of school health clinic and office support tasks for Baltimore City Public Schools. Work of this class involves no supervisory duties or responsibilities. Incumbents receive moderate supervision from a technical superior. Employees in this class work a conventional workweek. Work is performed in a school health clinic or health suite where there is occasional exposure to body fluids and students with contagious illnesses. Work requires minimal physical exertion. DISTINGUISHING FEATURES OF THE WORK Not Applicable.,/careers/baltimorecity/classspecs/791595
71,33232,Secretary II,A Secretary II performs a wide variety of administrative support work. Work of this class involves no supervisory duties or responsibilities. Incumbents receive moderate supervision from an administrative superior. Employees in this class work a conventional workweek. Work is performed in an office setting where working conditions are normal. Work requires minimal physical exertion. DISTINGUISHING FEATURES OF THE WORK The work of this class is distinguished from that of Secretary I in that it involves performing administrative support duties independently after minimal orientation.,/careers/baltimorecity/classspecs/791597
71,33233,Secretary III,A Secretary III performs administrative support work involving complicated subject matters and complex procedures and assigns and reviews the work of lower level employees or performs confidential administrative or office support work for a high-level City executive. Work of this class involves no supervisory duties or responsibilities. Incumbents receive general supervision from an administrative superior. Employees in this class work a conventional workweek. Work is performed in an office setting where working conditions are normal. Work requires minimal physical exertion. DISTINGUISHING FEATURES OF THE WORK The work of this class is distinguished from that of Secretary II in that it...,/careers/baltimorecity/classspecs/791598
71,41228,Senior Fire Operations Aide,"A Senior Fire Operations Aide provides a wide variety of administrative and technical support to an Assistant Chief of the Fire Department. Work of this class involves leading lower level field staff and office personnel. Incumbents receive general supervision from a technical superior. Employees in this class work a conventional workweek and are on-call 24 hours. Work is performed in an office as well as on the scene of emergency and non-emergency incidents where there is frequent exposure to hazardous conditions such as burning buildings, toxic fumes, driving hazards and collapsing structures. Work requires minimal physical activity such as handling heavy equipment and wearing breathing...",/careers/baltimorecity/classspecs/922681
71,41240,"Senior Fire Operations Aide, ALS","A Senior Fire Operations Aide, ALS provides a wide variety of administrative and technical support to an Assistant Chief of the Fire Department.  Work of this class involves leading lower level field staff and office personnel. Incumbents receive general supervision from a technical superior.  Employees in this class work a conventional workweek and are on-call 24 hours.  Work is performed in an office as well as on the scene of emergency and non-emergency incidents where there is frequent exposure to hazardous conditions such as burning buildings, toxic fumes, driving hazards and collapsing structures.  Work requires minimal physical activity such as handling heavy equipment and wearing...",/careers/baltimorecity/classspecs/1148892
