page,code,title,blurb,href
43,33629,HR Specialist II,"An HR Specialist II performs developmental professional staff work at the full performance level in the areas of employee selection, classification and compensation or employee benefits. Work of this class involves no supervisory duties or responsibilities. Incumbents receive moderate supervision from a technical superior. Employees in this class work a conventional workweek. Work is performed in an office where there are no uncomfortable or hazardous working conditions. Work requires minimal physical exertion. DISTINGUISHING FEATURES OF THE WORK The work of this class is distinguished from that of the class of HR Specialist I in that it involves a considerable amount of independent...",/careers/baltimorecity/classspecs/791269
43,33630,HR Specialist III,"An HR Specialist III performs complex professional work and coordinates studies, programs, operations and administrative functions in classification and compensation, employment test development or employee recruitment and selection. Work of this class involves leading professional, paraprofessional and clerical staff, but does not involve full supervisory duties or responsibilities. Incumbents receive general supervision from a technical superior. Employees in this class work a conventional workweek, subject to evening or weekend work as required. Work is performed in an office where there are few uncomfortable or hazardous working conditions. Work requires minimal physical exertion....",/careers/baltimorecity/classspecs/791270
43,33626,HRIS Analyst,"An HRIS Analyst performs a wide range of workforce analytics and administrative support functions; extracts models, analyzes and reports on human resource demographics and workforce trending for the Department of Human Resources. Work of this class involves no supervisory duties or responsibilities. Incumbents receive general supervision from a technical superior. Employees in this class work a conventional workweek, subject to evenings and weekend work as required. Work is performed in an office setting where employees are exposed to normal working conditions. Work requires minimal physical exertion. DISTINGUISHING FEATURES OF THE WORK Not applicable.",/careers/baltimorecity/classspecs/918389
43,33627,HRIS Specialist,"An HRIS Specialist provides technical and administrative support to the testing, implementation and maintenance of Baltimore City’s human resources information system (HRIS) in the Department of Human Resources and serves as a liaison between the Department and agency Human Resource representatives and the information technology department and vendors. Work of this class involves no supervisory duties or responsibilities. Incumbents receive general supervision from a technical superior. Employees in this class work a conventional workweek, subject to evenings and weekend work as required. Work is performed in an office setting where employees are exposed to normal working conditions. Work...",/careers/baltimorecity/classspecs/918391
43,84325,Human Services Manager,"A Human Services Manager oversees the operation of a center, which provides such human service assistance as case management, community liaison, project management and information and referral work to residents of an assigned City district. Work of this class involves supervising case management and office support staff. Incumbents receive general supervision from an administrative superior. Employees in this class work a conventional workweek, which may include evening and weekend meetings. Work is performed in an office setting or in the community where normal working conditions are encountered. Work requires minimal physical exertion. DISTINGUISHING FEATURES OF THE WORK Not Applicable.",/careers/baltimorecity/classspecs/791271
43,84321,Human Services Worker I,"A Human Services Worker I performs case management, community liaison, complaint and problem resolution, information and referral work related to City, State and private institution services in a City neighborhood. The work of this class involves no supervisory duties or responsibilities. Incumbents receive general supervision from a technical superior. Employees in this class work a conventional workweek, although, on occasion, evening and weekend hours and shift work may be required. Work may be performed in an office under normal working conditions and in undesirable neighborhoods under poor working conditions involving unsanitary conditions, irate citizens and the extremes of weather....",/careers/baltimorecity/classspecs/791272
43,84323,Human Services Worker II,"A Human Services Worker II assigns and reviews the work of human services personnel and performs case management, community liaison, complaint and problem resolution, information and referral work related to City, State and private institution services in a City neighborhood. The work of this class involves no supervisory duties or responsibilities. Incumbents receive general supervision from a technical superior. Employees in this class work a conventional workweek, although, on occasion, evening and weekend hours and shift work may be required. Work may be performed in an office under normal working conditions and in undesirable neighborhoods under poor working conditions involving...",/careers/baltimorecity/classspecs/791273
43,52134,Hydraulic Mechanic,"A Hydraulic Mechanic diagnoses, troubleshoots, repairs, rebuilds or adjusts hydraulic and related systems on a variety of specialized and heavy equipment. Work of this class involves no supervisory duties or responsibilities. Incumbents receive moderate supervision from a technical superior.    Employees in this class may work shift work including weekend hours and are subject to callback. Work is performed in an automotive repair shop where unpleasant odors and dirty and greasy shop conditions are regularly encountered. Work requires strenuous physical exertion including lifting, bending, crawling and periods of prolonged standing. DISTINGUISHING FEATURES OF THE WORK Not Applicable.",/careers/baltimorecity/classspecs/791274
43,61295,Immunization Registry Coordinator,An Immunization Registry Coordinator implements and maintains an Immunization Registry for Baltimore City. Work of this class involves no supervisory duties. Incumbents receive general supervision from a technical superior. Employees in this class work a conventional work week. Work is performed in offices where there is minimal exposure to environmental hazards. Work requires minimal physical exertion. DISTINGUISHING FEATURES OF THE WORK Not Applicable.,/careers/baltimorecity/classspecs/791275
44,54463,Impoundment Services Supervisor I,"An Impoundment Services Supervisor I oversees the daily operation of an abandoned storage or impounded vehicle lot. Work of this class involves supervising tow truck operators. Incumbents receive general supervision from a technical superior. Employees in this class work irregular hours including evening, weekend and holiday work. Work is performed in an office where incumbents encounter no uncomfortable or hazardous working conditions. Work requires minimal physical exertion. DISTINGUISHING FEATURES OF THE WORK The work of this class is distinguished from that of an Impoundment Services Supervisor II in that it involves overseeing the operations of one abandoned vehicle or impoundment lot...",/careers/baltimorecity/classspecs/791276
44,81380,Information and Referral Worker,An Information and Referral Worker responds to requests for and provides information and referral assistance regarding available community and health care resources. Work of this class involves no supervisory duties or responsibilities. Incumbents receive moderate supervision from a technical superior. Employees in this class work a conventional workweek. Work is performed in an office where there is no exposure to environmental hazards. Work requires minimal physical exertion. DISTINGUISHING FEATURES OF THE WORK Not Applicable.,/careers/baltimorecity/classspecs/791278
44,33159,Information Technology Specialist,"An Information Technology Specialist provides technical support to customers for personal computers and network system infrastructure equipment, including testing, updating, maintaining, and providing training on mainframe client servers and microcomputer software and hardware; responds to more complex helpdesk requests. Work of this class may involve leading and training paraprofessional information technology staff, but does not involve full supervisory duties or responsibilities. Incumbents receive general supervision from a technical superior. Employees in this class work a conventional workweek. Work is performed in office settings where there is no exposure to uncomfortable or...",/careers/baltimorecity/classspecs/922692
44,61261,Injury Prevention Specialist,"An Injury Prevention Specialist conducts on-site workplace evaluations and designs, organizes and conducts in-service programs for the prevention of occupational injuries and illnesses. Work of this class involves no supervisory duties or responsibilities. Incumbents receive moderate supervision from a technical superior. Employees in this class work a conventional workweek. Work is performed primarily in a classroom setting, where there is little exposure to uncomfortable or hazardous working conditions. Work requires moderate physical exertion. DISTINGUISHING FEATURES OF THE WORK Not Applicable.",/careers/baltimorecity/classspecs/791281
44,42231,Inspection Associate I,"An Inspection Associate I enforces City ordinances concerning the paving, repaving and repairing of alleys, footways and curbs by performing onsite inspections. The work of this class involves no supervisory duties or responsibilities. Incumbents receive moderate supervision from a technical superior. Employees in this class work a conventional workweek; some evening and weekend hours may be required. Work is performed outdoors where incumbents are regularly exposed to inclement weather, construction sites and traffic. Work requires minimal physical exertion; however, there may be periods of prolonged walking or standing. DISTINGUISHING FEATURES OF THE WORK The work of this class is...",/careers/baltimorecity/classspecs/791282
44,42232,Inspection Associate II,"An Inspection Associate II assigns, reviews and gives work direction to subordinate inspectors engaged in performing site inspections of alleys, footways and curbs to enforce City ordinances. Work of this class involves no supervisory duties or responsibilities. Incumbents receive moderate supervision from a technical superior. Employees in this class work a conventional workweek; some evening and weekend hours may be required. Work is performed outdoors where incumbents are regularly exposed to inclement weather, construction sites and traffic. Work requires minimal physical exertion; however, there may be periods of prolonged walking or standing. DISTINGUISHING FEATURES OF THE WORK The...",/careers/baltimorecity/classspecs/791283
44,42235,Inspection Associate Supervisor,"An Inspection Associate Supervisor assigns, schedules and supervises the work of subordinate inspectors engaged in the enforcement of City ordinances concerning the paving, repaving and repairing of alleys, footways and curbs. Work of this class involves supervising inspection personnel. Incumbents receive general supervision from an administrative superior. Employees in this class work a conventional workweek; some evening and weekend hours may be required. Work is performed outdoors where incumbents are exposed to construction sites, traffic and inclement weather. Work requires minimal physical exertion. DISTINGUISHING FEATURES OF THE WORK Not Applicable.",/careers/baltimorecity/classspecs/791284
44,42911,Inspector Trainee,"An Inspector Trainee receives training in inspection practices and procedures in a construction or code enforcement field. Work of this class involves no supervisory duties or responsibilities. Incumbents receive close supervision from a technical superior. Employees in this class work a conventional workweek. Work is performed outdoors or in dwellings where there is exposure to adverse weather, unsanitary conditions and construction or traffic hazards. Work requires standing, walking or climbing on a regular basis. DISTINGUISHING FEATURES OF THE WORK The work of this class involves the performance of entry-level inspection work in one of the following areas: public works, pollution control,...",/careers/baltimorecity/classspecs/791285
44,52620,Instrumentation Technician (Apprentice),"An Instrumentation Technician (Apprentice) receives classroom and on-the-job training in the maintenance and repair of instrumentation, hydraulic, pneumatic, and mechanical equipment. Work of this class involves no supervisory duties or responsibilities. Incumbents receive close supervision from a technical superior. Employees in this class work rotating evening, night, weekend and holiday shifts and are subject to call-back. Work is performed in pumping stations or treatment plants where there is exposure to noise, heat, high voltage equipment, chemicals, dirt, and toxic or explosive gases. Work requires moderate physical exertion. DISTINGUISHING FEATURES OF THE WORK Not Applicable.",/careers/baltimorecity/classspecs/791286
44,52621,Instrumentation Technician I,"An Instrumentation Technician I installs, maintains and repairs basic electronic, instrumentation, hydraulic and mechanical equipment in pumping stations, elevated tanks and related treatment facilities. Work of this class involves no supervisory duties or responsibilities. Incumbents receive close supervision from a technical superior. Employees in this class work rotating evening, night, weekend and holiday shifts and are subject to callback. Work is performed in pumping stations and related treatment facilities where incumbents are exposed to noise, heat, high voltage equipment, chemicals, dirt and toxic or explosive gases. Work requires moderate physical exertion. DISTINGUISHING FEATURES...",/careers/baltimorecity/classspecs/791287
45,52622,Instrumentation Technician II,"An Instrumentation Technician II installs, maintains and repairs complex electronic, instrumentation, hydraulic and mechanical equipment in treatment plants, pumping stations, elevated tanks, and related facilities. The work of this class involves no supervisory responsibilities. Incumbents receive moderate supervision from a technical superior. Employees in this class work rotating, evening, night, weekend and holiday shifts and are subject to call back. Work is performed in pumping stations and related treatment facilities where incumbents are exposed to noise, heat, high voltage equipment, chemicals, dirt, and toxic or explosive gases. Work requires moderate physical exertion....",/careers/baltimorecity/classspecs/791288
45,52625,Instrumentation Technician Supervisor I,"An Instrumentation Technician Supervisor I oversees the activities of subordinate workers engaged in the installation, maintenance and repair of electronic, hydraulic and mechanical equipment in treatment plants, pumping stations and related facilities. Work of this class involves supervising instrumentation technicians. Incumbents receive general supervision from a technical superior. Employees in this class work a conventional workweek; callback or overtime work may be required in emergencies. Work is performed in pumping stations where incumbents are exposed to noise, heat, high voltage equipment, chemicals, dirt, and toxic or explosive gases. Work requires moderate physical exertion....",/careers/baltimorecity/classspecs/791289
45,52626,Instrumentation Technician Supervisor II,"An Instrumentation Technician Supervisor II, through subordinate supervisors, oversees the activities of workers engaged in the installation, maintenance and repair of electronic, instrumentation, hydraulic and mechanical equipment in treatment plants, pumping stations, and related facilities. Work of this class involves directing the activities of maintenance and repair, and office support work units. Incumbents receive general supervision from a technical superior. Employees in this class work a conventional workweek; callback or overtime may be required in emergencies. Work is performed in pumping stations where incumbents are exposed to noise, heat, high voltage equipment, chemicals,...",/careers/baltimorecity/classspecs/791290
45,31941,Insurance and Risk Finance Manager,"An Insurance and Risk Finance Manager develops, analyzes and coordinates a Citywide risk management insurance program. The work of this class involves no supervisory duties or responsibilities. Incumbents receive general supervision from a technical superior. Employees in the class work a conventional workweek. Work is performed in an office where normal working conditions are encountered. Work requires minimal physical exertion. DISTINGUISHING FEATURES OF THE WORK Not Applicable.",/careers/baltimorecity/classspecs/791291
45,31951,Insurance/Risk Analyst,"An Insurance/Risk Analyst participates in developing, implementing, managing and coordinating a City-wide insurance program. The work of this class involves no supervisory duties or responsibilities. Incumbents receive general supervision from a technical superior. Employees in this class work a conventional workweek. Work is performed in an office where normal working conditions are encountered. Work requires minimal physical exertion. DISTINGUISHING FEATURES OF THE WORK Not Applicable.",/careers/baltimorecity/classspecs/791292
45,34454,Investment Analyst,An Investment Analyst assists in recommending and implementing investment strategies aimed at making optimal use of City retirement funds and performs a wide variety of complex financial work and investment product and market analysis. Work of this class involves no supervisory duties or responsibilities. Incumbents receive managerial direction from a technical superior. Employees in this class work a conventional work week that may include some evening hours. Work is primarily performed in a traditional office setting. Work requires minimal physical exertion. DISTINGUISHING FEATURES OF THE WORK Not Applicable.,/careers/baltimorecity/classspecs/1029780
45,33106,IT Associate - BCIT,"IT Associate provides support and assistance.  Primary focus may be in the areas of computer operations, computer repair, wire and cable installation, user and desktop support (hardware and software), helpdesk, and data management. Incumbents receive moderate to general supervision.  Employees in this class work a conventional workweek.  Work is performed in office settings where there is no exposure to uncomfortable or hazardous working conditions.  Work may require moderate physical exertion in lifting pieces of equipment or working in confined areas. Work in the class has no supervisory responsibilities. DISTINGUISHING FEATURES OF THE WORK Not Applicable.",/careers/baltimorecity/classspecs/1148813
45,33116,IT Deputy Director - BCIT,"Alternate market titles: IT Operations Director, Information Technology Director, Telecommunications Engineering Director, Computer Services Director, Computer Operations Director, Information Systems Operations Director. DISTINGUISHING FEATURES OF THE WORK.   This position is differentiated from the IT Divisional Manager in that the class is focused on management and organizational responsibilities defined by the Agency Director.  Manages through teams of middle and technical managers.",/careers/baltimorecity/classspecs/1148838
45,33115,IT Division Manager - BCIT,"Alternate market titles: Division director, division head, computer operations manager, systems manager, applications manager, software manager, director, infrastructure and shared services. The position is responsible for planning, directing, controlling, evaluating, and staffing a division, i.e., two or more units, e.g., IT applications and systems development, data security, computer operations, etc.  DISTINGUISHING FEATURES OF THE WORK This is a senior management position; reports directly to the IT Director MOIT (Deputy Agency Director).  It is differentiated from the IT Manager as it supervises subordinate staff through directly reporting managers/project managers over two or more...",/careers/baltimorecity/classspecs/1148835
45,33191,IT Engineer,"An IT Engineer designs, installs, troubleshoots and monitors information technology–based com­muni­ca­tions systems in a City agency.    The work of this class involves no supervisory duties or responsi­bi­li­ties. Incumbents receive general supervisor from a technical superior. Employees in this class work a conventional workweek. Work is performed in an office environment where normal working conditions are encountered. Work requires minimal physical exertion. DISTINGUISHING FEATURES OF THE WORK Not Applicable.",/careers/baltimorecity/classspecs/791293
46,33112,IT Manager - BCIT,"Alternative market titles:  IT manager, Computer operations manager, Systems manager, Applications manager, Software manager, Computer operations manager, manager, enterprise applications integration. This position reports to the IT Division Manager; responsible for direct supervision and management of a unit of technical staff IT applications and systems development, data security, computer operations units etc.  Implements all strategies for all IT operations and supervises efficient working of all IT staff and ensures compliance to all deadlines and provides upgrade to all systems as required. DISTINGUISHING FEATURES OF THE WORK This position is differentiated from the IT Project Manager...",/careers/baltimorecity/classspecs/1148822
46,33160,IT Project Manager,"An IT Project Manager plans, coordinates and directs the development, oversight and coordination for information technology projects within a city agency IT unit. Work of this class involves leading teams of information technology professionals or technical personnel.  Incumbents receive general supervision from an administrative superior. Employees in this class work a conventional workweek. Work is performed in an office, where working conditions are normal. Work requires minimal physical effort. DISTINGUISHING FEATURES OF THE WORK Not Applicable.",/careers/baltimorecity/classspecs/1095530
46,33114,IT Project Manager - BCIT,"Alternative market titles:   Supervisory business analyst, project supervisor, systems coordinator, chief data officer, customer service manager, enterprise applications officer. This position manages the day-to-day technical, operational, and administrative aspects of an agency-budgeted project through all lifecycles, i.e., design through to completion. DISTINGUISHING FEATURES OF THE WORK The IT Project Manager is differentiated from the IT Supervisor in that this class manages the work of teams assigned to enterprise, temporary, and ad hoc projects typically of defined scope.",/careers/baltimorecity/classspecs/1148834
46,33107,IT Specialist I - BCIT,"Alternate market titles:  Systems analyst, applications systems analyst/programmer, database specialist, systems programmer, network engineer, GIS analyst, architectural engineer, business analyst, quality improvement specialist, helpdesk analyst, security analyst. An Information Technology Specialist provides technical support to customers for personal computers, network system infrastructure equipment, including testing, updating, maintaining, and providing training on mainframe client servers and microcomputer software and hardware; responds to helpdesk requests.  Work of this class may involve leading and training less experienced IT Specialists, but does not involve full supervisory...",/careers/baltimorecity/classspecs/1148814
46,33109,IT Specialist II - BCIT,"Alternate market titles:  Systems analyst, applications systems analyst/programmer, database specialist, systems programmer, network engineer, GIS analyst, architectural engineer, business analyst, quality improvement specialist, helpdesk analyst, security analyst. An Information Technology Specialist provides technical support to customers for personal computers, network system infrastructure equipment, including testing, updating, maintaining, and providing training on mainframe client servers and microcomputer software and hardware; responds to helpdesk requests.  Work of this class may involve leading and training less experienced IT Specialists, but does not involve full supervisory...",/careers/baltimorecity/classspecs/1148816
46,33110,IT Specialist III - BCIT,"Alternate market titles:  Systems analyst, applications systems analyst/programmer, database specialist, systems programmer, network engineer, GIS analyst, architectural engineer, business analyst, quality improvement specialist, helpdesk analyst, security analyst. An Information Technology Specialist provides technical support to customers for personal computers, network system infrastructure equipment, including testing, updating, maintaining, and providing training on mainframe client servers and microcomputer software and hardware; responds to helpdesk requests.  Work of this class may involve leading and training less experienced IT Specialists, but does not involve full supervisory...",/careers/baltimorecity/classspecs/1148817
